word,mini,en
si-viro,"si-viro i de en-savi a mi ke viva i ke, an mori i sinifi a ke, an rason ke amo e ma poten sama si-duo.","He made me see what Life is, and what Death signifies, and why Love is stronger than both."
si-viro,Tom i dire ke si-viro i ave dire o ni a mentira.,Tom claims that he's never told a lie.
sige,Tom i ave a vile-tempo de dipa-melankoli de-i sige de lin de dipa-enejia ato.,Tom has periods of debilitating depression followed by bursts of manic activity.
sige,tu e sige.,You are next.
Sikago,mi i kan gana a Sikago karera se mi i uben e sufi duro.,I could win the Chicago Marathon if I train hard enough.
silen,mega silen i sede en bete kasa ve so mui de viro an feme i de more enkonte en ota dia.,An impressive silence broods over the monstrous structure where such multitudes of men and women were wont to assemble in other days.
silen,Tom i de kipa e silen vile da-ma-impotan-manja.,Tom remained silent during dinner.
Sina,bon-veni go Sina!,Welcome to China!
sinifi,"si-viro i de en-savi a mi ke viva i ke, an mori i sinifi a ke, an rason ke amo e ma poten sama si-duo.","He made me see what Life is, and what Death signifies, and why Love is stronger than both."
sino,i jage a sino de fungi-veni.,Look for signs of decomposition.
siren,mi i de dimenti redi a siren go sekola.,I forgot to set the alarm for school.
siti-senta,Sami i de kamina go siti-senta.,Sami walked downtown.
sivi-neso,Tom i ave a duo sivi-neso.,Tom has dual citizenship.
so,"Mennad e so nulo-sekura, ankora.",Mennad is still so insecure.
so,mega silen i sede en bete kasa ve so mui de viro an feme i de more enkonte en ota dia.,An impressive silence broods over the monstrous structure where such multitudes of men and women were wont to assemble in other days.
sole-luse,sole-luse i make ke mala-eleki-peso en sela i move an enejia e make.,The sunlight makes the electrons in the cells move and energy is produced.
solo,Tom an mi i de e no solo man ke i de via-viva.,Tom and I weren't the only ones who survived.
solo,Tom i de aseta o solo a semi liabili.,Tom only accepted partial responsibility.
some,Sami i de move a si go Mosr go some tempo.,Sami ended up moving to Egypt for a while.
some,tu i da favo amo-enkonte e some tempo?,Would you like to go out sometime?
some-kosa,mi i de make a some-kosa seketa.,I did something mysterious.
some-kosa,mi i de no arapan a some-kosa sama da.,I did not expect something like that.
some-si-uno,tu i kan voka a some-si-uno go-i pota a mi sako go supa?,Could you have someone carry my bag upstairs?
some-tempo,"some-tempo, mala kosa i pasa go bon man.",Sometimes bad things happen to good people.
su,mi labora i veni e su duro.,My work becomes too hard.
su,Tom e su antika ke si i no kan make a da.,Tom is already too old to do that.
subita-lan,"ota paso, an tu i go unda e en subita-lan.","Another step, and you will fall down the precipice."
sufi,si-feme e sufi bela.,She's beautiful enough.
sufi,tu e sufi matura ke tu i kan ade a tu-ego.,You are old enough to take care of yourself.
sujesi,tu i da sujesi a ke go Tom?,What would you recommend to Tom?
Sumatra,Sumatra a ila.,Sumatra is an island.
sumete,ke man i de sumete?,Who surrendered?
supa-ato,i no e supa-ato.,Don't be condescending.
supose,mi i ave supose ke solo moda mi i kan make a di e ke Tom i ade a mi.,I've figured out that the only way I can do this is to get Tom to help me.
supose,mi i de supose ke Tom i de savi a ke mi-ale i de en pale.,I assumed that Tom understood what we were talking about.
sure,"se tu i dire go Tom ke si-viro i debe make a ke, mi e sure ke si-viro i go make a si.","If you tell Tom what to do, I'm sure he'll do it."
sure,tu i go kan savi o sure e ke se tu i de roga o ni?,How could you know for certain if you never asked?
tamen,"mi-ale debe kipa di, tamen.","We should stay here, however."
tamen,"tamen si i go mori, si deside open a loka.","Although s/he will die, s/he decides to open the lock."
tea,tu i vole a kafe u tea?,Do you want coffee or tea?
tempo,"pasa tempo ke mi i de go a litora, mi de-i mui sole-fogo.","The last time I went to the beach, I got badly sunburned."
tempo,ale demon i de apara e sama tempo go-i kapa a si-ale mudi-make.,The demons came out all at once to capture their prey.
ten,i numa go ten.,Count to ten.
tenta,Mary i de mentira-make no savi ke Tom i de tenta dire a si-feme.,Mary pretended not to understand what Tom was trying to tell her.
tenta,si-viro i de tenta no pensa o no ma a si-feme.,He made an effort not to think about her any more.
tera,universa-viva-siensa a etudi de orijen de viva en tera an mebi de viva en universa.,Astrobiology is the study of life’s origins on Earth and the potential for life in Universe.
tera-vibe,ke i orijen a tera-vibe?,What causes earthquakes?
teta,Tom i de baka-dona a si note-pape en si teta poke.,Tom put his pad back into his breast pocket.
tila,"en-i open o mui lenta o ade a ventana, si-ale i de arapan-kipa tila kali nube i de ave osura o semi a eve, an den uno de uno i de kamina go mini gaden.","Opening the window very slowly and carefully, they waited until a dark cloud had somewhat obscured the night, and then one by one passed through into the little garden."
tingi,i mira a tingi bela feme ke i en ereki e da.,Look at the tall pretty girl standing there.
tingi-foli-lan,lenta-unda fogo en-i veni e de tingi-foli-lan.,Parachute fire coming over the mesa.
tingi-tingi-sekola,"Mario i de kan ave go a ani tingi-tingi-sekola ke si-viro i de vole, pero si-viro i de eleti UConn ka si viro-paren i de go a da.","Mario could have gone to any college he wanted, but he chose UConn because that’s where his dad went."
tipo,ke man i kopen a di tipo de seni?,Who buys this type of art?
toma,mi i toma a kosa go tu.,I take the thing to you.
toma,some man i de toma a si. mi i no savi a ke man.,Someone took it. I don’t know who.
tori,a mui tipo de tori.,There are many kinds of birds.
tu,mi i arapan ke tu i go ave a bon afa-semi-dia.,I hope you have a good afternoon.
tu,tu a feme-kinde u viro-kinde?,Are you a girl or a boy?
tuerk,Layla i de en tuerk a si pigu.,Layla was twerking her ass.
tuju,Tom i jeritan o tuju go mi.,Tom always yells at me.
tumba,gen-viva de no-mori bete i de kon-pasa kon ruina de si tumba.,The revival of the undead beast coincided with the destruction of his tomb.
u,Großer Tiergarten u Tiergarten e mega komun gaden de-i loke en semi de Belin.,The Großer Tiergarten or Tiergarten is a large public park located in the middle of Berlin.
u,Tom i de kan viva a ma u meno medi viva afa medika-metodo.,Tom was able to live a more or less normal life after the operation.
ubuntu,"da a da ma ubuntu puni go ofensa-man, no?",Isn't that the most humane punishment for criminals?
unda,"animale, en-e mega su, i unda.","The animal, being too large, falls."
unda,"kalori-ke-mui e unda nulo, di-dia.",The temperature is below zero today.
unda-go,Ziri i de unda-go a lada e mui ade.,Ziri very carefully descended the stairs.
unda-go-vasa,i mira a da unda-go-vasa!,Look at that waterfall!
unda-meno,"si-ale i limi a si-ale-ego go solo litera, numa, unda-meno an punto go ke rason?","Why limit themselves to only letters, numbers, underscore and punctum?"
uno,Brasil e mui rika; si rika e mui mega; kafe e uno de si o da ma mega rika.,Brazil is very rich; its richness is immense; coffee is one of its greatest riches.
uno,Tom i de veni en dia-1 an i de baka-go e uno dia afa.,Tom came on Monday and went back the day after.
uno-punto-sita-kilo-mita,"ante tu i dona-mala-name a some, tu i debe kamina a uno-punto-sita-kilo-mita en si sapato.","Before you criticize someone, you should walk a mile in their shoes."
uti,tu i vole uti a ke kosa?,Which thing do you want to use?
vakansa-navi,vakansa-navi en-i dive.,The cruise ship is sinking.
vakili-name,tu vakili-name a ke?,What are your pronouns?
vakili-umile,mi i senti a vakili-umile.,I feel proxyshame.
vaku-man,vaku-man i kan mira a najima ka si ventana i en punto eki de Tera.,The spaceman can see the star because his window is pointing away from Earth.
vali,kali i de kova o ankora a vali.,Darkness still covered the valley.
vasa,a vasa.,There is water.
vasa,e vasa.,It’s wet.
vasa-foreta,si-ale i de go e en a vasa-foreta.,They entered the jungle.
vasa-retili,vasa-retili i kan mori a man.,Crocodiles can kill people.
ve,mega silen i sede en bete kasa ve so mui de viro an feme i de more enkonte en ota dia.,An impressive silence broods over the monstrous structure where such multitudes of men and women were wont to assemble in other days.
veji,"en-i no vasa a veji, a mala kosa.",Not watering the plants is a bad thing.
veji,"veji i develo en gaden, sama foli-veji, rondo-foli-vejii, onion, alio, melon, bianka-kera-veji, bianka-rondo-radika-veji, ruja-rondo-radika-veji, kavalo-rondo-radika-veji, roka-antika-gadi, longo-midori-melon an oranje-melon.","Greens and vegetables grow in gardens, such as lettuce, cabbage, onions, garlic, gourd, parsnip, turnip, radish, horse radish, parsley, cucumbers and pumpkin."
veka,si-viro i de veka a si-viro fili go Faser dua.,He woke his son up for the fajr prayer.
ven,"salu! ven tu i ave a ma tempo, i veni an ludi!","Goodbye! When you have more time, come back and play!"
ven,junta i de ave begin ludi o jusa ven regen i de begin.,The teams had just started to play when it began to rain.
vende,sesi i vende.,Sex sells.
vende-man,"an, a vende-man ke i apojo a Linux.",There are also vendors who support Linux.
veni,"de nun, tu i go veni e tu ego.","From here on out, you'll be on your own."
veni,"mi i go veni e di sige-dia, mi i pensa.","I'll be here tomorrow, I think."
veni,mini viro i go veni a mega viro.,The small man will be a big man.
vere,en-i etudi a Barbari de-i ave e vere joli go mi.,Studying Berber has been a real joy for me.
vere,vere duro e ke tu i no savi o ankora ke mi-ale i ave a duro.,The real problem is you don't even know we have a problem.
vere-fule-neso,si-uno i no nese dire ke vere-fule-neso e da ma bon ajenda.,It goes without saying that honesty is the best policy.
veta,da ke veta i de go make i de e no apara.,It wasn't obvious what the weather was going to do.
via,"via penta ano de duka o sela-develo-maladi terapi, si-viro i de fini-make kipa a dereka fase.","Throughout the five years of painful cancer treatments, he managed to keep a stiff upper lip."
via-relate,"via via-relate kalite, tu i de pipi en si-viro boka.",By the transitive property you peed in his mouth.
via-vari-eleki-uti,inventi de via-vari-eleki-uti i de begin a nu aje.,The invention of the transistor introduced a new era.
vila,si-feme vila e en kolina.,Her villa sits on the hill.
vile,"vile tu open a loka, mi toma a mi fini nafasa.","While you open the lock, I take my last breath."
vile,Tom i de kipa e silen vile da-ma-impotan-manja.,Tom remained silent during dinner.
vile-tempo,nu mundo semi-aje vile-tempo i en veni.,A new worldwide medieval era is coming on.
vile-tempo,Tom i ave a vile-tempo de dipa-melankoli de-i sige de lin de dipa-enejia ato.,Tom has periods of debilitating depression followed by bursts of manic activity.
vina-moda,dona-mala-name-man i go dire ke ale de di a vina-moda.,The critics will say this is all whataboutism.
vino,"medi, vino de kaja e no mui bon.",Boxed wine isn't usually very good.
vino,i favo pota a semi botelo de vino go mi.,Please bring me a half-bottle of wine.
viro,mega silen i sede en bete kasa ve so mui de viro an feme i de more enkonte en ota dia.,An impressive silence broods over the monstrous structure where such multitudes of men and women were wont to assemble in other days.
viro,mega viro i manja.,The big man eats.
viro-kinde,da viro-kinde e mui lasi!,How lazy those boys are!
viro-kinde,viro-kinde i de sede inta feme-kinde.,The boy sat among the girls.
viro-paren,si-viro viro-paren i de aseta a mi ajenda anti si-viro vole.,His father consented to my plan against his will.
viro-paren,viro-paren de Sami i de dire-abuso o mui a si.,Sami's father put him down a lot.
viva,mi i no viva e nea di.,I don't live around here.
viva,Tom i de kan viva a ma u meno medi viva afa medika-metodo.,Tom was able to live a more or less normal life after the operation.
voka,tu i ave voka o deja a sano-karo?,Have you already called an ambulance?
voka,Yanni i de voka o momen a polisa.,Yanni called the police immediately.
vole,mi i no vole a ma ronko-dire.,I don't want any more complaining.
vole,tu i vole etudi o mui a si?,Do you want to study it further?
vori,mi e mui vori de di tema.,I'm very concerned about these matters.
